{"dataset":"yields","api_version":"v1","schema_version":"1.1.0","schema_url":"https://blockchains.github.io/blockchainlab-api/v1/schemas/yields.schema.json","description":"Top 500 DeFi yield pools by TVL (>= $10m) with APY, base/reward split, IL risk. Snapshot from DefiLlama; APYs change constantly and are not advice.","generated_at":"2026-10-21T08:37:36.083Z","source":"DefiLlama yields","source_url":"https://yields.llama.fi/pools","built_by":"Blockchain Lab — https://blockchainlab.com","licence_note":"Data belongs to the named source; check its terms before reuse. Attribute the source and Blockchain Lab.","count":500,"data":[{"pool":"747c1d2a-c668-4682-b9f9-296708a3dd90","project":"lido","chain":"Ethereum","symbol":"STETH","tvl_usd":23603655973,"apy":2.225,"apy_base":2.225,"apy_reward":null,"apy_mean_30d":2.23738,"stablecoin":false,"il_risk":"no","exposure":"single","defillama_url":"https://defillama.com/yields/pool/747c1d2a-c668-4682-b9f9-296708a3dd90"},{"pool":"80b8bf92-b953-4c20-98ea-c9653ef2bb98","project":"binance-staked-eth","chain":"Ethereum","symbol":"WBETH","tvl_usd":8637589278,"apy":2.24073,"apy_base":2.24073,"apy_reward":null,"apy_mean_30d":2.23202,"stablecoin":false,"il_risk":"no","exposure":"single","defillama_url":"https://defillama.com/yields/pool/80b8bf92-b953-4c20-98ea-c9653ef2bb98"},{"pool":"46bd2bdf-6d92-4066-b482-e885ee172264","project":"ether.fi-stake","chain":"Ethereum","symbol":"WEETH","tvl_usd":5390383772,"apy":2.27287,"apy_base":2.27287,"apy_reward":0,"apy_mean_30d":2.28755,"stablecoin":false,"il_risk":"no","exposure":"single","defillama_url":"https://defillama.com/yields/pool/46bd2bdf-6d92-4066-b482-e885ee172264"},{"pool":"d8c4eff5-c8a9-46fc-a888-057c4c668e72","project":"sky-lending","chain":"Ethereum","symbol":"SUSDS","tvl_usd":4830891241,"apy":3.8,"apy_base":3.8,"apy_reward":null,"apy_mean_30d":3.69124,"stablecoin":true,"il_risk":"no","exposure":"single","defillama_url":"https://defillama.com/yields/pool/d8c4eff5-c8a9-46fc-a888-057c4c668e72"},{"pool":"db678df9-3281-4bc2-a8bb-01160ffd6d48","project":"aave-v3","chain":"Ethereum","symbol":"WEETH","tvl_usd":3738502812,"apy":0.00002,"apy_base":0.00002,"apy_reward":null,"apy_mean_30d":0.00002,"stablecoin":false,"il_risk":"no","exposure":"single","defillama_url":"https://defillama.com/yields/pool/db678df9-3281-4bc2-a8bb-01160ffd6d48"},{"pool":"3b45941c-16cb-48c5-a490-16c6c4f1d86a","project":"sparklend","chain":"Ethereum","symbol":"WSTETH","tvl_usd":3503630751,"apy":0,"apy_base":0,"apy_reward":null,"apy_mean_30d":0,"stablecoin":false,"il_risk":"no","exposure":"single","defillama_url":"https://defillama.com/yields/pool/3b45941c-16cb-48c5-a490-16c6c4f1d86a"},{"pool":"7d33d57d-36dc-414b-9538-22a223250468","project":"morpho-blue","chain":"Base","symbol":"CBBTC","tvl_usd":3311500746,"apy":0,"apy_base":0,"apy_reward":null,"apy_mean_30d":0,"stablecoin":false,"il_risk":"no","exposure":"single","defillama_url":"https://defillama.com/yields/pool/7d33d57d-36dc-414b-9538-22a223250468"},{"pool":"43641cf5-a92e-416b-bce9-27113d3c0db6","project":"maple","chain":"Ethereum","symbol":"USDC","tvl_usd":2804590186,"apy":5.09556,"apy_base":5.09556,"apy_reward":0,"apy_mean_30d":5.18918,"stablecoin":true,"il_risk":"no","exposure":"single","defillama_url":"https://defillama.com/yields/pool/43641cf5-a92e-416b-bce9-27113d3c0db6"},{"pool":"7e382157-b1bc-406d-b17b-facba43b716e","project":"aave-v3","chain":"Ethereum","symbol":"WBTC","tvl_usd":2758431746,"apy":0.00325,"apy_base":0.00325,"apy_reward":null,"apy_mean_30d":0.0033,"stablecoin":false,"il_risk":"no","exposure":"single","defillama_url":"https://defillama.com/yields/pool/7e382157-b1bc-406d-b17b-facba43b716e"},{"pool":"7c0a89c7-70cf-460c-b62e-cb278bf97e8f","project":"circle-usyc","chain":"BSC","symbol":"USYC","tvl_usd":2346774274,"apy":3.61777,"apy_base":3.61777,"apy_reward":null,"apy_mean_30d":3.31448,"stablecoin":false,"il_risk":"no","exposure":"single","defillama_url":"https://defillama.com/yields/pool/7c0a89c7-70cf-460c-b62e-cb278bf97e8f"},{"pool":"e6435aae-cbe9-4d26-ab2c-a4d533db9972","project":"aave-v3","chain":"Ethereum","symbol":"WSTETH","tvl_usd":2316289187,"apy":0.00049,"apy_base":0.00049,"apy_reward":null,"apy_mean_30d":0.00046,"stablecoin":false,"il_risk":"no","exposure":"single","defillama_url":"https://defillama.com/yields/pool/e6435aae-cbe9-4d26-ab2c-a4d533db9972"},{"pool":"b1986007-81f3-4150-9565-94d5a4066ce4","project":"aave-v3","chain":"Ethereum","symbol":"CBBTC","tvl_usd":1428218326,"apy":0.00123,"apy_base":0.00123,"apy_reward":null,"apy_mean_30d":0.00105,"stablecoin":false,"il_risk":"no","exposure":"single","defillama_url":"https://defillama.com/yields/pool/b1986007-81f3-4150-9565-94d5a4066ce4"},{"pool":"ac61ee82-2fe4-4f9b-a9cd-7fb33f598859","project":"ondo-yield-assets","chain":"Ethereum","symbol":"USDY","tvl_usd":1260613117,"apy":3.71,"apy_base":3.71,"apy_reward":null,"apy_mean_30d":3.6343,"stablecoin":false,"il_risk":"no","exposure":"single","defillama_url":"https://defillama.com/yields/pool/ac61ee82-2fe4-4f9b-a9cd-7fb33f598859"},{"pool":"d4b3c522-6127-4b89-bedf-83641cdcd2eb","project":"rocket-pool","chain":"Ethereum","symbol":"RETH","tvl_usd":1257674895,"apy":1.86255,"apy_base":1.86255,"apy_reward":null,"apy_mean_30d":2.12663,"stablecoin":false,"il_risk":"no","exposure":"single","defillama_url":"https://defillama.com/yields/pool/d4b3c522-6127-4b89-bedf-83641cdcd2eb"},{"pool":"66985a81-9c51-46ca-9977-42b4fe7bc6df","project":"ethena-usde","chain":"Ethereum","symbol":"SUSDE","tvl_usd":1201401301,"apy":4.78724,"apy_base":4.78724,"apy_reward":null,"apy_mean_30d":4.93385,"stablecoin":true,"il_risk":"no","exposure":"single","defillama_url":"https://defillama.com/yields/pool/66985a81-9c51-46ca-9977-42b4fe7bc6df"},{"pool":"ae255d3e-5f02-4edd-aab3-ba43eead3a06","project":"justlend-v1","chain":"Tron","symbol":"ETH","tvl_usd":1196328469,"apy":0.00028,"apy_base":0.00028,"apy_reward":0,"apy_mean_30d":0.00028,"stablecoin":false,"il_risk":"no","exposure":"single","defillama_url":"https://defillama.com/yields/pool/ae255d3e-5f02-4edd-aab3-ba43eead3a06"},{"pool":"9e709e57-84eb-496b-82ce-2e8f6a17db1b","project":"binance-staked-sol","chain":"Solana","symbol":"BNSOL","tvl_usd":1119030265,"apy":4.52767,"apy_base":4.52767,"apy_reward":null,"apy_mean_30d":4.57646,"stablecoin":false,"il_risk":"no","exposure":"single","defillama_url":"https://defillama.com/yields/pool/9e709e57-84eb-496b-82ce-2e8f6a17db1b"},{"pool":"0e7d0722-9054-4907-8593-567b353c0900","project":"jito-liquid-staking","chain":"Solana","symbol":"JITOSOL","tvl_usd":1111438347,"apy":4.84,"apy_base":4.84,"apy_reward":null,"apy_mean_30d":4.77713,"stablecoin":false,"il_risk":"no","exposure":"single","defillama_url":"https://defillama.com/yields/pool/0e7d0722-9054-4907-8593-567b353c0900"},{"pool":"33c732f6-a78d-41da-af5b-ccd9fa5e52d5","project":"kelp","chain":"Ethereum","symbol":"RSETH","tvl_usd":980007254,"apy":2.21,"apy_base":2.21,"apy_reward":null,"apy_mean_30d":2.31658,"stablecoin":false,"il_risk":"no","exposure":"single","defillama_url":"https://defillama.com/yields/pool/33c732f6-a78d-41da-af5b-ccd9fa5e52d5"},{"pool":"e880e828-ca59-4ec6-8d4f-27182a4dc23d","project":"aave-v3","chain":"Ethereum","symbol":"WETH","tvl_usd":976630742,"apy":1.31143,"apy_base":1.31143,"apy_reward":null,"apy_mean_30d":1.38552,"stablecoin":false,"il_risk":"no","exposure":"single","defillama_url":"https://defillama.com/yields/pool/e880e828-ca59-4ec6-8d4f-27182a4dc23d"},{"pool":"bd0f5a2a-5d74-40bd-a7db-bf1538b314a2","project":"blackrock-buidl","chain":"Aptos","symbol":"BUIDL","tvl_usd":967824821,"apy":3.4881,"apy_base":3.4881,"apy_reward":null,"apy_mean_30d":3.35595,"stablecoin":true,"il_risk":"no","exposure":"single","defillama_url":"https://defillama.com/yields/pool/bd0f5a2a-5d74-40bd-a7db-bf1538b314a2"},{"pool":"590d770e-ed5d-4c8d-ad96-5178c2072295","project":"blackrock-buidl","chain":"Solana","symbol":"BUIDL","tvl_usd":886118412,"apy":3.79866,"apy_base":3.79866,"apy_reward":null,"apy_mean_30d":3.65634,"stablecoin":true,"il_risk":"no","exposure":"single","defillama_url":"https://defillama.com/yields/pool/590d770e-ed5d-4c8d-ad96-5178c2072295"},{"pool":"9f25a954-db87-4bb2-a8b2-4be0b843a44c","project":"kinetiq-khype","chain":"Hyperliquid L1","symbol":"KHYPE","tvl_usd":839271665,"apy":1.90637,"apy_base":1.90637,"apy_reward":null,"apy_mean_30d":2.02286,"stablecoin":false,"il_risk":"no","exposure":"single","defillama_url":"https://defillama.com/yields/pool/9f25a954-db87-4bb2-a8b2-4be0b843a44c"},{"pool":"31e2bebc-85e6-4974-b2e3-7f24675095cf","project":"justlend-v1","chain":"Tron","symbol":"STRX","tvl_usd":779294336,"apy":0.00236,"apy_base":0.00236,"apy_reward":0,"apy_mean_30d":0.00198,"stablecoin":false,"il_risk":"no","exposure":"single","defillama_url":"https://defillama.com/yields/pool/31e2bebc-85e6-4974-b2e3-7f24675095cf"},{"pool":"50bb5f69-85ea-4f70-81da-3661a1633fc4","project":"lista-liquid-staking","chain":"BSC","symbol":"SLISBNB","tvl_usd":768409240,"apy":0.68526,"apy_base":0.68526,"apy_reward":null,"apy_mean_30d":0.90994,"stablecoin":false,"il_risk":"no","exposure":"single","defillama_url":"https://defillama.com/yields/pool/50bb5f69-85ea-4f70-81da-3661a1633fc4"},{"pool":"2393da89-4672-4812-b45a-7c8552603a20","project":"concrete","chain":"Ethereum","symbol":"CTDELTAWEETH","tvl_usd":754834110,"apy":0,"apy_base":0,"apy_reward":null,"apy_mean_30d":0,"stablecoin":false,"il_risk":"no","exposure":"single","defillama_url":"https://defillama.com/yields/pool/2393da89-4672-4812-b45a-7c8552603a20"},{"pool":"8edfdf02-cdbb-43f7-bca6-954e5fe56813","project":"maple","chain":"Ethereum","symbol":"USDT","tvl_usd":744742581,"apy":5.33944,"apy_base":5.33944,"apy_reward":0,"apy_mean_30d":5.28266,"stablecoin":true,"il_risk":"no","exposure":"single","defillama_url":"https://defillama.com/yields/pool/8edfdf02-cdbb-43f7-bca6-954e5fe56813"},{"pool":"51d2f8d4-1fb5-4f6b-938b-e9cd17ca1ceb","project":"sky-lending","chain":"Ethereum","symbol":"WETH","tvl_usd":720604235,"apy":0,"apy_base":null,"apy_reward":n